[
  {
    "id": "vibemathed:composites-among-xi-7-n:assertion",
    "problem_id": "vibemathed:composites-among-xi-7-n",
    "source_id": "vibemathed",
    "external_id": "composites-among-xi-7-n",
    "retrieved_at": "2026-08-18T00:00:00.000Z",
    "source_updated_at": "2026-08-17T15:54:39.560Z",
    "assertion_type": "solution-status-report",
    "status": "resolved",
    "raw": {
      "slug": "composites-among-xi-7-n",
      "name": "Composites Among $[\\xi 7^n]$ and Right-Truncatable Primes in Base 7",
      "shortName": "Composites among $[\\xi 7^n]$",
      "problemNumber": null,
      "field": "Number theory - integer sequences",
      "fieldGroup": "Number theory",
      "statement": "For every real $\\xi>0$ the sequence of integer parts $[\\xi 7^{n}]$, $n=0,1,2,\\dots$, contains infinitely many composite numbers. Second, there is no infinite right truncatable prime in base 7.",
      "posedBy": "Forman and Shapiro (1967), Dubickas and Novikas (2005)",
      "yearPosed": 2005,
      "solveType": "proved",
      "resolution": "resolved",
      "aiContribution": "ai-discovered",
      "solveDate": "2026-08-15",
      "model": "Fable 5, Opus 4.8",
      "modelMaker": "Anthropic",
      "humanCollaborators": [],
      "aiRole": "The source reports an AI-produced computational route, certificate, Lean formalization, and draft under human direction.",
      "verification": "lean-checked",
      "verificationNote": "VibeMathed reports a source audit with a documented native_decide boundary; VibeMath did not compile or independently audit it.",
      "publication": "preprint",
      "resolutionMethod": "computation",
      "significance": 10,
      "solveCostUsd": null,
      "sourceUrl": "https://www.researchgate.net/publication/412294027_On_the_composites_among_x7",
      "sourceName": "On the composites among [ξ7ⁿ]",
      "links": [
        {
          "label": "Lean development, data and generating programs",
          "url": "https://github.com/rwst/On-Composites",
          "kind": "lean-proof"
        }
      ],
      "relations": []
    },
    "normalized": {
      "status": "resolved",
      "solution_event_type": "proved",
      "ai_contribution": "ai_discovered",
      "verification": "lean_checked_statement_unaudited"
    },
    "supporting_evidence": [
      {
        "label": "On the composites among [ξ7ⁿ]",
        "url": "https://www.researchgate.net/publication/412294027_On_the_composites_among_x7",
        "kind": "primary-mathematical-source",
        "license": null
      },
      {
        "label": "VibeMathed: Composites Among $[\\xi 7^n]$ and Right-Truncatable Primes in Base 7",
        "url": "https://vibemathed.com/problem/composites-among-xi-7-n",
        "kind": "source-assertion",
        "license": "CC BY 4.0 (https://creativecommons.org/licenses/by/4.0/)"
      },
      {
        "label": "Lean development, data and generating programs",
        "url": "https://github.com/rwst/On-Composites",
        "kind": "lean-proof",
        "license": null
      }
    ],
    "confidence": 0.7,
    "data_license": "CC BY 4.0 (https://creativecommons.org/licenses/by/4.0/)",
    "content_hash": "sha256:e75b63aeaec02c0039a89fb0abedf880557696677593398a590d3aed1d403391"
  },
  {
    "id": "vibemathed:erdos-planar-unit-distance:assertion",
    "problem_id": "vibemathed:erdos-planar-unit-distance",
    "source_id": "vibemathed",
    "external_id": "erdos-planar-unit-distance",
    "retrieved_at": "2026-08-18T00:00:00.000Z",
    "source_updated_at": "2026-08-17T15:54:39.560Z",
    "assertion_type": "solution-status-report",
    "status": "resolved",
    "raw": {
      "slug": "erdos-planar-unit-distance",
      "name": "Erdős's Planar Unit Distance Conjecture",
      "shortName": "Unit Distance Conjecture",
      "problemNumber": 90,
      "field": "Combinatorial Geometry",
      "fieldGroup": "Geometry & topology",
      "statement": "Erdős conjectured an $n^{1+o(1)}$ upper bound on the number of unit-distance pairs among $n$ points in the plane. A construction with more than $n^{1.014}$ pairs disproves that conjectured asymptotic upper bound; the exact extremal unit-distance problem remains open.",
      "posedBy": "Paul Erdős",
      "yearPosed": 1946,
      "solveType": "disproved",
      "resolution": "resolved",
      "aiContribution": "ai-co-developed",
      "resultNote": "The asymptotic conjecture was disproved; this does not determine the exact unit-distance extremal function.",
      "solveDate": "2026-05-27",
      "model": "OpenAI frontier model (specific version not disclosed)",
      "modelMaker": "OpenAI",
      "humanCollaborators": [
        "Noga Alon",
        "Thomas Bloom",
        "Timothy Gowers",
        "Daniel Litt",
        "Will Sawin",
        "Jacob Tsimerman",
        "Melanie Matchett Wood"
      ],
      "aiRole": "Model-assisted construction of a point configuration reported to have more than $n^{1.014}$ unit-distance pairs.",
      "verification": "expert-verified",
      "verificationNote": "VibeMathed reports human expert verification and an arXiv write-up; VibeMath preserves that label as a source assertion.",
      "publication": "preprint",
      "resolutionMethod": "construction",
      "significance": 40,
      "solveCostUsd": null,
      "sourceUrl": "https://arxiv.org/abs/2605.20695",
      "sourceName": "Remarks on the disproof of the unit distance conjecture",
      "links": [],
      "relations": []
    },
    "normalized": {
      "status": "resolved",
      "solution_event_type": "disproved",
      "ai_contribution": "ai_co_developed",
      "verification": "independent_expert_verified"
    },
    "supporting_evidence": [
      {
        "label": "Remarks on the disproof of the unit distance conjecture",
        "url": "https://arxiv.org/abs/2605.20695",
        "kind": "primary-mathematical-source",
        "license": null
      },
      {
        "label": "VibeMathed: Erdős's Planar Unit Distance Conjecture",
        "url": "https://vibemathed.com/problem/erdos-planar-unit-distance",
        "kind": "source-assertion",
        "license": "CC BY 4.0 (https://creativecommons.org/licenses/by/4.0/)"
      }
    ],
    "confidence": 0.7,
    "data_license": "CC BY 4.0 (https://creativecommons.org/licenses/by/4.0/)",
    "content_hash": "sha256:55ff2fba4cbd1f981f0665c64d949836d78c4e08396775133e1ff6fbeff53d8b"
  },
  {
    "id": "vibemathed:quartic-hessian-conjecture-dimension-four:assertion",
    "problem_id": "vibemathed:quartic-hessian-conjecture-dimension-four",
    "source_id": "vibemathed",
    "external_id": "quartic-hessian-conjecture-dimension-four",
    "retrieved_at": "2026-08-18T00:00:00.000Z",
    "source_updated_at": "2026-08-17T15:54:39.560Z",
    "assertion_type": "solution-status-report",
    "status": "partial",
    "raw": {
      "slug": "quartic-hessian-conjecture-dimension-four",
      "name": "The Quartic Hessian Conjecture in Dimension Four",
      "shortName": "Quartic Hessian, n=4",
      "problemNumber": null,
      "field": "Polynomial automorphisms",
      "fieldGroup": "Algebra",
      "statement": "The Hessian conjecture is open exactly in dimension four. The source reports a proof for every quartic polynomial in dimension four, a proper slice of the full open problem.",
      "posedBy": "The Hessian conjecture (de Bondt, van den Essen line)",
      "yearPosed": null,
      "solveType": "proved",
      "resolution": "partial",
      "aiContribution": "ai-assisted",
      "solveDate": "2026-08-14",
      "model": "GPT-5.6 Sol, GPT-5.6 Luna, Claude Fable 5, DeepSeek V4 Pro",
      "modelMaker": "OpenAI, Anthropic, DeepSeek",
      "humanCollaborators": [
        "Zixiang Ni"
      ],
      "aiRole": "The source credits AI systems with exploring candidate arguments, adversarial review, algebraic checking, and editorial assistance.",
      "verification": "unreviewed",
      "verificationNote": "VibeMathed reports a days-old sole-author preprint and no independent review.",
      "publication": "preprint",
      "resolutionMethod": "argument",
      "significance": 15,
      "solveCostUsd": null,
      "sourceUrl": "https://arxiv.org/abs/2608.14217",
      "sourceName": "The Quartic Hessian Conjecture in Dimension Four",
      "links": [],
      "relations": []
    },
    "normalized": {
      "status": "partial",
      "solution_event_type": "proved",
      "ai_contribution": "ai_assisted",
      "verification": "unreviewed"
    },
    "supporting_evidence": [
      {
        "label": "The Quartic Hessian Conjecture in Dimension Four",
        "url": "https://arxiv.org/abs/2608.14217",
        "kind": "primary-mathematical-source",
        "license": null
      },
      {
        "label": "VibeMathed: The Quartic Hessian Conjecture in Dimension Four",
        "url": "https://vibemathed.com/problem/quartic-hessian-conjecture-dimension-four",
        "kind": "source-assertion",
        "license": "CC BY 4.0 (https://creativecommons.org/licenses/by/4.0/)"
      }
    ],
    "confidence": 0.7,
    "data_license": "CC BY 4.0 (https://creativecommons.org/licenses/by/4.0/)",
    "content_hash": "sha256:755b016a38772ddffafd8b4aa93da228a29daefb84a85e2f69accee747cb811f"
  },
  {
    "id": "vibemathed:erdos-267:assertion",
    "problem_id": "vibemathed:erdos-267",
    "source_id": "vibemathed",
    "external_id": "erdos-267",
    "retrieved_at": "2026-08-18T00:00:00.000Z",
    "source_updated_at": "2026-08-17T15:54:39.560Z",
    "assertion_type": "solution-status-report",
    "status": "candidate",
    "raw": {
      "slug": "erdos-267",
      "name": "Erdős Problem #267",
      "shortName": "Erdős #267",
      "problemNumber": 267,
      "field": "Number Theory, Irrationality",
      "fieldGroup": "Number theory",
      "statement": "If $n_1<n_2<\\cdots$ with $n_{k+1}/n_k\\ge c>1$, must $\\sum_k 1/F_{n_k}$ be irrational? The proposed proof closes the range $1<c<2$ left open by earlier criteria.",
      "posedBy": "Paul Erdős",